{
  "$schema": "http://json-schema.org/draft-07/schema#",
  "$id": "https://github.com/software-description-language/spec/layer_logic/manifest.schema.json",
  "title": "SDL ServiceManifest",
  "description": "The bounded container for a software service description. One manifest per repo. Declares what this service is, what it owns, and what interfaces it exposes and consumes.",
  "type": "object",
  "dl": {
    "profile": "software",
    "version": "0.1",
    "concepts": ["Container"],
    "layer": "schema",
    "layer_ref": "layer_logic",
    "notes": "ServiceManifest is the top-level Container in SDL at layer_logic. It groups all Operations (Units) within a single service boundary. The synthesis tool reads exposes[] and consumes[] to construct ServiceActor objects at layer_platform."
  },
  "required": ["dlVersion", "id", "label"],
  "additionalProperties": false,
  "properties": {
    "dlVersion": {
      "type": "string",
      "description": "The SDL spec version this file conforms to.",
      "pattern": "^\\d+\\.\\d+$",
      "examples": ["0.1"]
    },
    "id": {
      "type": "string",
      "description": "Unique kebab-case identifier for this service. Stable — used as a reference key by entry-points, dependencies, and synthesis tools.",
      "pattern": "^[a-z0-9][a-z0-9-_]*[a-z0-9]$",
      "examples": ["order-service", "payment-service", "inventory-service"]
    },
    "label": {
      "type": "string",
      "description": "Human-readable display name for this service.",
      "examples": ["Order Service", "Payment Service"]
    },
    "description": {
      "type": "string",
      "description": "One paragraph describing what this service owns and why it exists. Write for a senior engineer reading it cold."
    },
    "domain": {
      "type": "string",
      "description": "The business domain this service belongs to. Aligns with DDD bounded contexts.",
      "examples": ["order-management", "payments", "inventory", "identity"]
    },
    "responsibilities": {
      "type": "array",
      "description": "Plain-language list of what this service is responsible for.",
      "items": { "type": "string" },
      "examples": [["Create and validate orders", "Own the order state machine", "Emit order lifecycle events"]]
    },
    "technology": {
      "type": "object",
      "description": "Technology stack. Informational only.",
      "additionalProperties": false,
      "properties": {
        "language":  { "type": "string", "examples": ["TypeScript", "Go", "Python", "Java"] },
        "framework": { "type": "string", "examples": ["Express", "FastAPI", "Spring Boot", "Gin"] },
        "runtime":   { "type": "string", "examples": ["Node 20", "Python 3.12", "JVM 21"] },
        "platform":  { "type": "string", "examples": ["Kubernetes", "AWS Lambda", "Cloud Run"] }
      }
    },
    "exposes": {
      "type": "array",
      "description": "The interfaces this service exposes to the outside world. Written in protocol-prefixed notation. These become the ServiceActor.exposes[] at layer_platform.",
      "items": { "type": "string" },
      "examples": [["rest:POST /orders", "rest:GET /orders/{id}", "event:order.created", "grpc:OrderService/CreateOrder"]]
    },
    "consumes": {
      "type": "array",
      "description": "External interfaces this service depends on. These become the ServiceActor.consumes[] at layer_platform.",
      "items": { "type": "string" },
      "examples": [["event:payment.completed", "rest:GET /inventory/{id}"]]
    },
    "contracts": {
      "type": "array",
      "description": "Links to external contract definitions this service owns.",
      "items": {
        "type": "object",
        "required": ["type", "ref"],
        "additionalProperties": false,
        "properties": {
          "type": {
            "type": "string",
            "enum": ["openapi", "protobuf", "avro", "graphql", "asyncapi", "json-schema", "custom"]
          },
          "ref": {
            "type": "string",
            "examples": ["./contracts/order-service.openapi.yaml", "./contracts/order.proto"]
          }
        }
      }
    },
    "tags": {
      "type": "array",
      "items": { "type": "string" },
      "examples": [["core-domain", "team-checkout", "pci-scope", "critical-path"]]
    },
    "stats": {
      "type": "object",
      "description": "Auto-generated summary counts. Populated by tooling, not hand-authored.",
      "additionalProperties": false,
      "properties": {
        "entry_points": { "type": "integer", "minimum": 0 },
        "operations":   { "type": "integer", "minimum": 0 },
        "data_shapes":  { "type": "integer", "minimum": 0 },
        "dependencies": { "type": "integer", "minimum": 0 }
      }
    },
    "meta": {
      "type": "object",
      "additionalProperties": true
    }
  }
}
